<?xml version="1.0" encoding="UTF-8"?>
<!DOCTYPE theme PUBLIC "//WebContext//DTD Themes 1.0/EN" "../../dtd/themes.dtd">
<theme>
	<shortname>default</shortname>
	<name>Default</name>
	<description>A default theme for the template rendering framework</description>
	<author>Frederic Delorme(frederic.delorme@gmail.com)</author>
	<version>1.0</version>
	<date>2010/08/12</date>
	<encoding>UTF-8</encoding>
</theme>